<?xml version="1.0" encoding="UTF-8"?>
<!--W3C Schema generated by XMLSPY v5 rel. 4 U (http://www.xmlspy.com)-->
<xs:schema xmlns:xs="http://www.w3.org/2001/XMLSchema" xmlns:xbrli="http://www.xbrl.org/2003/instance" elementFormDefault="qualified">
	<xs:import namespace="http://www.xbrl.org/2003/instance" schemaLocation="http://www.xbrl.org/2003/xbrl-instance-2003-12-31.xsd"/>
	<xs:attribute name="readMeFirst" type="xs:boolean" default="false"/>
	<xs:attribute name="validatorExclude" type="xs:boolean" default="false"/>
	<xs:complexType name="inputFileType">
		<xs:simpleContent>
			<xs:extension base="xs:string">
				<xs:attribute ref="readMeFirst" use="optional"/>
				<xs:attribute ref="validatorExclude" use="optional"/>
			</xs:extension>
		</xs:simpleContent>
	</xs:complexType>
	<xs:element name="xsd" type="inputFileType"/>
	<xs:element name="linkbase" type="inputFileType"/>
	<xs:element name="instance" type="inputFileType"/>
	<xs:element name="data">
		<xs:complexType>
			<xs:choice minOccurs="1" maxOccurs="unbounded">
				<xs:element ref="xsd"/>
				<xs:element ref="linkbase"/>
				<xs:element ref="instance"/>
			</xs:choice>
		</xs:complexType>
	</xs:element>
	<xs:element name="result">
		<xs:complexType>
			<xs:simpleContent>
				<xs:extension base="xs:string">
					<xs:attribute name="expected" use="required">
						<xs:simpleType>
							<xs:restriction base="xs:NMTOKEN">
								<xs:enumeration value="invalid"/>
								<xs:enumeration value="valid"/>
							</xs:restriction>
						</xs:simpleType>
					</xs:attribute>
				</xs:extension>
			</xs:simpleContent>
		</xs:complexType>
	</xs:element>
	<xs:element name="description" type="xs:string"/>
	<xs:element name="variation">
		<xs:complexType>
			<xs:sequence>
				<xs:element ref="description"/>
				<xs:element ref="data"/>
				<xs:element ref="result"/>
			</xs:sequence>
			<xs:attribute name="id" type="xs:ID" use="required"/>
			<xs:attribute name="name" use="required">
				<xs:simpleType>
					<xs:restriction base="xs:string"/>
				</xs:simpleType>
			</xs:attribute>
		</xs:complexType>
	</xs:element>
	<xs:element name="testcase">
		<xs:complexType>
			<xs:sequence>
				<xs:element ref="variation" minOccurs="0" maxOccurs="unbounded"/>
			</xs:sequence>
			<xs:attribute name="name" type="xs:string" use="required"/>
			<xs:attribute name="description" type="xs:string" use="required"/>
			<xs:attribute name="outpath" type="xs:string" use="required"/>
			<xs:attribute name="owner" type="xs:string" use="required"/>
			<xs:attribute name="minimal" type="xs:boolean" use="optional" default="true"/>
		</xs:complexType>
	</xs:element>
	<xs:element name="instances">
		<xs:complexType>
			<xs:sequence>
				<xs:element ref="xbrli:xbrl" maxOccurs="unbounded"/>
			</xs:sequence>
		</xs:complexType>
	</xs:element>
</xs:schema>
